[
  {
    "id": "election:ek-1983-08-31",
    "body": "org:eerste-kamer",
    "date": "1983-08-31",
    "kind": "regulier",
    "seatsTotal": 75,
    "turnout": null,
    "validVotes": null,
    "seats": [
      {
        "party": "CDA",
        "seats": 26,
        "votes": null,
        "share": null
      },
      {
        "party": "VVD",
        "seats": 17,
        "votes": null,
        "share": null
      },
      {
        "party": "PvdA",
        "seats": 17,
        "votes": null,
        "share": null
      },
      {
        "party": "D66",
        "seats": 6,
        "votes": null,
        "share": null
      },
      {
        "party": "CPN",
        "seats": 2,
        "votes": null,
        "share": null
      },
      {
        "party": "SGP",
        "seats": 2,
        "votes": null,
        "share": null
      },
      {
        "party": "PSP",
        "seats": 2,
        "votes": null,
        "share": null
      },
      {
        "party": "PPR",
        "seats": 1,
        "votes": null,
        "share": null
      },
      {
        "party": "GPV",
        "seats": 1,
        "votes": null,
        "share": null
      },
      {
        "party": "RPF",
        "seats": 1,
        "votes": null,
        "share": null
      }
    ],
    "notes": "Bron Parlement.com (medium). Eerste verkiezing van de gehele Eerste Kamer in een keer voor vier jaar onder de Grondwet van 1983.",
    "source": {
      "source": "src:pdc-ek-1983",
      "retrieved": "2026-09-19",
      "confidence": "medium"
    }
  },
  {
    "id": "election:ek-1986-05-20",
    "body": "org:eerste-kamer",
    "date": "1986-05-20",
    "kind": "vervroegd",
    "seatsTotal": 75,
    "turnout": null,
    "validVotes": null,
    "seats": [
      {
        "party": "CDA",
        "seats": 26,
        "votes": null,
        "share": null
      },
      {
        "party": "PvdA",
        "seats": 17,
        "votes": null,
        "share": null
      },
      {
        "party": "VVD",
        "seats": 16,
        "votes": null,
        "share": null
      },
      {
        "party": "D66",
        "seats": 6,
        "votes": null,
        "share": null
      },
      {
        "party": "PPR",
        "seats": 2,
        "votes": null,
        "share": null
      },
      {
        "party": "CPN",
        "seats": 2,
        "votes": null,
        "share": null
      },
      {
        "party": "SGP",
        "seats": 2,
        "votes": null,
        "share": null
      },
      {
        "party": "PSP",
        "seats": 2,
        "votes": null,
        "share": null
      },
      {
        "party": "GPV",
        "seats": 1,
        "votes": null,
        "share": null
      },
      {
        "party": "RPF",
        "seats": 1,
        "votes": null,
        "share": null
      }
    ],
    "notes": "Bron Parlement.com (medium). Tussentijdse verkiezing na ontbinding wegens grondwetsherziening (eerste lezing), daarom kind vervroegd.",
    "source": {
      "source": "src:pdc-ek-1986",
      "retrieved": "2026-09-19",
      "confidence": "medium"
    }
  },
  {
    "id": "election:ek-1987-06-09",
    "body": "org:eerste-kamer",
    "date": "1987-06-09",
    "kind": "regulier",
    "seatsTotal": 75,
    "turnout": null,
    "validVotes": null,
    "seats": [
      {
        "party": "CDA",
        "seats": 26,
        "votes": null,
        "share": null
      },
      {
        "party": "PvdA",
        "seats": 26,
        "votes": null,
        "share": null
      },
      {
        "party": "VVD",
        "seats": 12,
        "votes": null,
        "share": null
      },
      {
        "party": "D66",
        "seats": 5,
        "votes": null,
        "share": null
      },
      {
        "party": "PPR",
        "seats": 1,
        "votes": null,
        "share": null
      },
      {
        "party": "CPN",
        "seats": 1,
        "votes": null,
        "share": null
      },
      {
        "party": "SGP",
        "seats": 1,
        "votes": null,
        "share": null
      },
      {
        "party": "PSP",
        "seats": 1,
        "votes": null,
        "share": null
      },
      {
        "party": "RPF",
        "seats": 1,
        "votes": null,
        "share": null
      },
      {
        "party": "GPV",
        "seats": 1,
        "votes": null,
        "share": null
      }
    ],
    "notes": "Bron Parlement.com (medium).",
    "source": {
      "source": "src:pdc-ek-1987",
      "retrieved": "2026-09-19",
      "confidence": "medium"
    }
  },
  {
    "id": "election:ek-1991-05-28",
    "body": "org:eerste-kamer",
    "date": "1991-05-28",
    "kind": "regulier",
    "seatsTotal": 75,
    "turnout": null,
    "validVotes": null,
    "seats": [
      {
        "party": "CDA",
        "seats": 27,
        "votes": null,
        "share": null
      },
      {
        "party": "PvdA",
        "seats": 16,
        "votes": null,
        "share": null
      },
      {
        "party": "VVD",
        "seats": 12,
        "votes": null,
        "share": null
      },
      {
        "party": "D66",
        "seats": 12,
        "votes": null,
        "share": null
      },
      {
        "party": "GL",
        "seats": 4,
        "votes": null,
        "share": null
      },
      {
        "party": "SGP",
        "seats": 2,
        "votes": null,
        "share": null
      },
      {
        "party": "RPF",
        "seats": 1,
        "votes": null,
        "share": null
      },
      {
        "party": "GPV",
        "seats": 1,
        "votes": null,
        "share": null
      }
    ],
    "notes": "Bron Parlement.com (medium).",
    "source": {
      "source": "src:pdc-ek-1991",
      "retrieved": "2026-09-19",
      "confidence": "medium"
    }
  },
  {
    "id": "election:ek-1995-05-29",
    "body": "org:eerste-kamer",
    "date": "1995-05-29",
    "kind": "regulier",
    "seatsTotal": 75,
    "turnout": null,
    "validVotes": null,
    "seats": [
      {
        "party": "VVD",
        "seats": 23,
        "votes": null,
        "share": null
      },
      {
        "party": "CDA",
        "seats": 19,
        "votes": null,
        "share": null
      },
      {
        "party": "PvdA",
        "seats": 14,
        "votes": null,
        "share": null
      },
      {
        "party": "D66",
        "seats": 7,
        "votes": null,
        "share": null
      },
      {
        "party": "GL",
        "seats": 4,
        "votes": null,
        "share": null
      },
      {
        "party": "AOV",
        "seats": 2,
        "votes": null,
        "share": null
      },
      {
        "party": "SGP",
        "seats": 2,
        "votes": null,
        "share": null
      },
      {
        "party": "RPF",
        "seats": 1,
        "votes": null,
        "share": null
      },
      {
        "party": "GPV",
        "seats": 1,
        "votes": null,
        "share": null
      },
      {
        "party": "SP",
        "seats": 1,
        "votes": null,
        "share": null
      },
      {
        "party": "POG",
        "seats": 1,
        "votes": null,
        "share": null
      }
    ],
    "notes": "Bron Parlement.com (medium). PDC-label \"POG/Groenen\" is opgenomen als POG.",
    "source": {
      "source": "src:pdc-ek-1995",
      "retrieved": "2026-09-19",
      "confidence": "medium"
    }
  },
  {
    "id": "election:ek-1999-05-25",
    "body": "org:eerste-kamer",
    "date": "1999-05-25",
    "kind": "regulier",
    "seatsTotal": 75,
    "turnout": null,
    "validVotes": null,
    "seats": [
      {
        "party": "CDA",
        "seats": 20,
        "votes": null,
        "share": null
      },
      {
        "party": "VVD",
        "seats": 19,
        "votes": null,
        "share": null
      },
      {
        "party": "PvdA",
        "seats": 15,
        "votes": null,
        "share": null
      },
      {
        "party": "GL",
        "seats": 8,
        "votes": null,
        "share": null
      },
      {
        "party": "D66",
        "seats": 4,
        "votes": null,
        "share": null
      },
      {
        "party": "GPV-RPF",
        "seats": 4,
        "votes": null,
        "share": null
      },
      {
        "party": "SGP",
        "seats": 2,
        "votes": null,
        "share": null
      },
      {
        "party": "SP",
        "seats": 2,
        "votes": null,
        "share": null
      },
      {
        "party": "OPNL",
        "seats": 1,
        "votes": null,
        "share": null
      }
    ],
    "notes": "Bron Parlement.com (medium); het Kiesraad-nieuwsbericht van 27-05-1999 noemt geen cijfers. GPV en RPF hadden een gezamenlijke lijst (PDC: \"GPV / RPF\", 4 zetels), opgenomen als GPV-RPF. OSF onder registersleutel OPNL.",
    "source": {
      "source": "src:pdc-ek-1999",
      "retrieved": "2026-09-19",
      "confidence": "medium"
    }
  },
  {
    "id": "election:ek-2003-05-26",
    "body": "org:eerste-kamer",
    "date": "2003-05-26",
    "kind": "regulier",
    "seatsTotal": 75,
    "turnout": 0.999,
    "validVotes": 161644,
    "seats": [
      {
        "party": "CDA",
        "seats": 23,
        "votes": null,
        "share": null
      },
      {
        "party": "PvdA",
        "seats": 19,
        "votes": null,
        "share": null
      },
      {
        "party": "VVD",
        "seats": 15,
        "votes": null,
        "share": null
      },
      {
        "party": "GL",
        "seats": 5,
        "votes": null,
        "share": null
      },
      {
        "party": "SP",
        "seats": 4,
        "votes": null,
        "share": null
      },
      {
        "party": "D66",
        "seats": 3,
        "votes": null,
        "share": null
      },
      {
        "party": "CU",
        "seats": 2,
        "votes": null,
        "share": null
      },
      {
        "party": "SGP",
        "seats": 2,
        "votes": null,
        "share": null
      },
      {
        "party": "LPF",